{
  "schemaVersion": "1.0.0",
  "evidenceId": "F2S-EVD-M00-002",
  "taskId": "F2S-DEV-M00-002",
  "status": "PASS",
  "command": "npm run release:verify",
  "exitCode": 0,
  "startedAtUtc": "2026-07-11T07:47:16.553Z",
  "endedAtUtc": "2026-07-11T07:47:16.553Z",
  "runner": {
    "kind": "local-development",
    "os": "win32 10.0.22631",
    "architecture": "x64",
    "hostnameHash": "f3da3e8c48fbc119008475bba247ec014ab39af1f7e5d05bd1609c4951e6d3d5"
  },
  "toolVersions": {
    "node": "v24.15.0"
  },
  "inputHashes": {},
  "outputHashes": {
    "docs/compliance/F2S-EXTERNAL-SYSTEMS-001.json": "aed8d50cd1a12b09b7fed723e38ddd2331109b563e662e6b26a122f8a18a7a4c",
    "docs/compliance/F2S-LICENSE-REVIEW-PLAYBOOK-001.md": "874c26997a3bb6a7eaa3020266b28523eb9a6fbeb1ebfb1885ee81229d0fec02",
    "docs/compliance/F2S-SUPPLY-INVENTORY-001.json": "b7b61ef5ad0e1592d3703e4496dad5692add04f18e6467ecafaba6c46a81e4d1",
    "tools/compliance/license-inventory-check.mjs": "5dc0542611021d68736d9e03aa2a0b5c64dae3db263637a6a336cdda2fd0e5e3"
  },
  "logRefs": [],
  "reportRefs": [
    "evidence/M00/F2S-DEV-M00-002/F2S-WU-M00-002-02/license-check.json"
  ],
  "capabilityState": "UNVERIFIED",
  "externalBlockers": [],
  "previousEvidenceRef": null,
  "notRunReason": null,
  "payload": {
    "summary": "Permissive license closure passes; legal opinion remains external.",
    "generatedBy": "tools/evidence/create-envelope.mjs"
  }
}
