{
  "schemaVersion": "1.0.0",
  "evidenceId": "F2S-EVD-M00-001",
  "taskId": "F2S-DEV-M00-001",
  "status": "PASS",
  "command": "npm run bootstrap:check",
  "exitCode": 0,
  "startedAtUtc": "2026-07-11T07:47:16.508Z",
  "endedAtUtc": "2026-07-11T07:47:16.508Z",
  "runner": {
    "kind": "local-development",
    "os": "win32 10.0.22631",
    "architecture": "x64",
    "hostnameHash": "f3da3e8c48fbc119008475bba247ec014ab39af1f7e5d05bd1609c4951e6d3d5"
  },
  "toolVersions": {
    "node": "v24.15.0"
  },
  "inputHashes": {},
  "outputHashes": {
    "tools/spikes/m00/toolchain-probe.ps1": "5bf5f2f04ca95cc41f629ca24b2f610ad3eb07d89cb104699bd8b01974de9e8c",
    "tools/spikes/m00/toolchain-probe.schema.json": "8dd20a426b71af2abecbc1c702fed99d6c344cfa73f6765862450ab1d5f987c9",
    "docs/decisions/F2S-TOOLCHAIN-BASELINE-001.md": "68be475ae8c5df0ab7177a71ce75ee9c54ac2e6077de908c55fa0802a97d0e00",
    "docs/decisions/F2S-INTEGRATION-TARGET-001.md": "1694ada81a26aa1c6950069533b6d23688c45568d9ae4eddb9668c49b3a2c79a"
  },
  "logRefs": [],
  "reportRefs": [
    "evidence/M00/F2S-DEV-M00-001/F2S-WU-M00-001-01/probe.json"
  ],
  "capabilityState": "UNVERIFIED",
  "externalBlockers": [],
  "previousEvidenceRef": null,
  "notRunReason": null,
  "payload": {
    "summary": "Local toolchain exact; clean VM pair pending.",
    "generatedBy": "tools/evidence/create-envelope.mjs"
  }
}
