{
  "schemaVersion": "1.0.0",
  "evidenceId": "F2S-EVD-M02-007",
  "taskId": "F2S-DEV-M02-007",
  "status": "PASS",
  "command": "cargo test -p f2s-adapters",
  "exitCode": 0,
  "startedAtUtc": "2026-07-11T07:47:17.246Z",
  "endedAtUtc": "2026-07-11T07:47:17.246Z",
  "runner": {
    "kind": "local-development",
    "os": "win32 10.0.22631",
    "architecture": "x64",
    "hostnameHash": "f3da3e8c48fbc119008475bba247ec014ab39af1f7e5d05bd1609c4951e6d3d5"
  },
  "toolVersions": {
    "node": "v24.15.0"
  },
  "inputHashes": {},
  "outputHashes": {
    "crates/adapters/src/storage/journal.rs": "785a96b3e2c94faa93871f178fb5f44eb823d5ba734d0706e8134e6b402349ac",
    "crates/adapters/src/storage/recovery.rs": "5b95f21ef643003430f22bdde407af1dc2ca8a9dc2e87007dfcea0f91e4ac571",
    "crates/adapters/src/storage/migration.rs": "599b23b8ced25bf975b1249cc2c1686e943bef935566b622b0ebb078846b5353",
    "crates/application/src/storage/recover_project.rs": "39ce4d1d05ea320b94e437724113f76ec5be570bff7153686471d1ad85a5feaf",
    "crates/application/src/storage/migrate_project.rs": "783ba43551064726d332788fa5a58c09759d607b87e810d771fab9f9ee78935c"
  },
  "logRefs": [],
  "reportRefs": [],
  "capabilityState": "UNVERIFIED",
  "externalBlockers": [],
  "previousEvidenceRef": null,
  "notRunReason": null,
  "payload": {
    "summary": "Recovery and copy-on-write migration primitives implemented; killpoints pending.",
    "generatedBy": "tools/evidence/create-envelope.mjs"
  }
}
