{
  "schemaVersion": "1.0.0",
  "evidenceId": "F2S-EVD-M01-001",
  "taskId": "F2S-DEV-M01-001",
  "status": "PASS",
  "command": "npm run lint",
  "exitCode": 0,
  "startedAtUtc": "2026-07-11T07:47:16.747Z",
  "endedAtUtc": "2026-07-11T07:47:16.747Z",
  "runner": {
    "kind": "local-development",
    "os": "win32 10.0.22631",
    "architecture": "x64",
    "hostnameHash": "f3da3e8c48fbc119008475bba247ec014ab39af1f7e5d05bd1609c4951e6d3d5"
  },
  "toolVersions": {
    "node": "v24.15.0"
  },
  "inputHashes": {},
  "outputHashes": {
    "Cargo.toml": "9c09f6aa7594bbea622c1633021f0213d780932edec7d22285f0e1c38d27fcdb",
    "crates/adapters/Cargo.toml": "bdc1e3f0b7d279674e4081945052372a78dc2f4ad85610594c93e5dfbd7fc4a5",
    "crates/adapters/src/ipc/framing.rs": "e65c09149f65803cc0856beb1eb054a7a106b831a7a0d7a67a145145919d81a7",
    "crates/adapters/src/ipc/mock.rs": "9877638c1a244dc9ce8a1d0b5e96edafe78d99044a30a5c2beda7b16b8a24076",
    "crates/adapters/src/ipc/mod.rs": "022c1d0cc262f5bea1f461850265d20ed90d9d11d528f17b4edc203bb618fa27",
    "crates/adapters/src/lib.rs": "f2e9108e7733360c0e3d1157a1f4e82d8766db0915761e1e223bc27f0c06d6a4",
    "crates/adapters/src/observability/jsonl_audit.rs": "c30409b85e94e95650f26a3bf6201867533e37844fa987a98b6f2832699e206f",
    "crates/adapters/src/observability/local_event_sink.rs": "3b334ff71d82cdb5817e51d7246717d7fa5156abe84bfe6932befd777a20bde2",
    "crates/adapters/src/observability/mod.rs": "8d757c21d9d87729aafa5c3936f80617b01e90352161b4aa48dee2d27cd2340c",
    "crates/adapters/src/storage/cas.rs": "6ab47045ef6ea119524e75f265326c07f836a439e3b2d6ffd9e8ca954e0e3aa6",
    "crates/adapters/src/storage/fs_project_store.rs": "42ea15b14950b6139ed58bb03b4bfdff8e04bf0ba6fdbd65e51899e39c3848ee",
    "crates/adapters/src/storage/journal.rs": "785a96b3e2c94faa93871f178fb5f44eb823d5ba734d0706e8134e6b402349ac",
    "crates/adapters/src/storage/migration.rs": "599b23b8ced25bf975b1249cc2c1686e943bef935566b622b0ebb078846b5353",
    "crates/adapters/src/storage/mod.rs": "e2f28eb2387d8d10962adafdd09bbeff15775ad59ab2edfa159547d4d6a3684d",
    "crates/adapters/src/storage/ntfs_atomic.rs": "a0e52e92d9b5fbe36eb7af7b8c43b492d80daede680045933a0f6f977c516d59",
    "crates/adapters/src/storage/recovery.rs": "5b95f21ef643003430f22bdde407af1dc2ca8a9dc2e87007dfcea0f91e4ac571",
    "crates/adapters/src/storage/redb_index.rs": "9214b683ea5ddedd8dfed40d0cce9e6825173771d5db391133694d98978a4d9a",
    "crates/adapters/tests/storage_ipc.rs": "37a7324c135a7c85a947f85b6d9c776dc799bed0c535455362152663d60a211e",
    "crates/application/Cargo.toml": "4f121a96e71d993cb7706560d8a8f3eb7d243e36db231aabeea76aa772295baf",
    "crates/application/src/commands/execute.rs": "4790805a6132ae7934bf1d4ecaddd3fe406e345cdf2086f2df34f4748ed7c7ee",
    "crates/application/src/commands/idempotency.rs": "cb1bccd2842bf56d117a0a0ed28407ab19c207c7be10daac6fb13adddc6b8ded",
    "crates/application/src/commands/mod.rs": "5c37f391b2b65aaa363a1add1d13a6ecccc10a5ac725fae5f6ef4028fd01973c",
    "crates/application/src/commands/undo_redo.rs": "a14a61c0fdfaf34979c1c749649fb5403b3c6d304e0cb26a9d58d121554d71cc",
    "crates/application/src/governance/evaluate_gate.rs": "ec653f3fcd7c7f818a63cb852ec4f4784e994fe35e1d04f13e2724584c6e71ee",
    "crates/application/src/governance/mod.rs": "48da4baea0ae50f40f3ead21894740bbe68deba04ac54be3dfc6444af24592e5",
    "crates/application/src/governance/resolve_dependencies.rs": "66625d5b0bfabefd6c77f7b6e3a6c8e3398b0c3aa5b4a2ffbd09fec19f639d28",
    "crates/application/src/jobs/mod.rs": "f803b0fa5dfbe9d0bb02741f73613413394c9670a493aed1937c809e77e87b56",
    "crates/application/src/jobs/register_candidate.rs": "418f1a9f8c0dbfdde16bbca09854c24516d9d25fd06071f90147cc0e1bb5f4ff",
    "crates/application/src/jobs/scheduler.rs": "93ca5ed6d619b62cd41e3723b3dad6602317176142c530b0ea18f15aed70c895",
    "crates/application/src/jobs/terminal_arbiter.rs": "44ddc65837bf1473944d41e479d58ebfcdc860fd43ce6005047e13986445f8a7",
    "crates/application/src/lib.rs": "f42c4256af321c3c3600810486e8adbd4f6cb826ad294f84db80a870c1f389b2",
    "crates/application/src/observability/emit.rs": "4372eedf40b2b28a3708cc8c3e5c528b26c771e3bc19a895f9aac0bc89fe0ba3",
    "crates/application/src/observability/mod.rs": "a797c36316e00a63b30a2ab57d18f80f5698a1f02459f1570a5420df5f76febd",
    "crates/application/src/ports/audit_sink.rs": "d452f0c5f9c95d6e068f1e4972916ac27d6242613134dd487510f03a9cfb0c81",
    "crates/application/src/ports/cas_store.rs": "1ac884cf9b1cd2bea45518944b57b27b9dc242f8a48db12ee6b83a00985d7898",
    "crates/application/src/ports/clock_store.rs": "39a62214f565c68e0f2eb56e9ec9608024dd89ccadd4b8164ff57fcc827ad0ba",
    "crates/application/src/ports/event_sink.rs": "c7f66318609b4f7da2bfeecf2f8611db0c28e4d7b6f8965cb7399be511ede1fc",
    "crates/application/src/ports/ipc.rs": "e55753af0ddeafeebf73e89896bcecbe773376598efa2266903c1207a7be42e6",
    "crates/application/src/ports/mod.rs": "af787b5c607eefceaba4f8f9bb1521a77931723329488864da9bdd7e0b5a6d7c",
    "crates/application/src/ports/project_store.rs": "bff4f87a8423f47ba1352a2019d8f9440865f692bb66c03aa00bfafd12d223ac",
    "crates/application/src/ports/worker_gateway.rs": "07f6c7b88012ec50e03720d4e954ee737f8e3d623733e4e91dd8e0eb539dcfaa",
    "crates/application/src/storage/governance_streams.rs": "3ff551162d13fe40ae51de00206a7d7d15ac6fd52a84672b06f4a5073d0de78b",
    "crates/application/src/storage/migrate_project.rs": "783ba43551064726d332788fa5a58c09759d607b87e810d771fab9f9ee78935c",
    "crates/application/src/storage/mod.rs": "b8d11494a8e5d2c61629a74a4d2fd4023a3850491b30af9a149de7a88774fe71",
    "crates/application/src/storage/project_transaction.rs": "8f5faf5c0778241f856836eeed4cf6173765f40d7d3e21dfc81d4d6600dd1ea5",
    "crates/application/src/storage/recover_project.rs": "39ce4d1d05ea320b94e437724113f76ec5be570bff7153686471d1ad85a5feaf",
    "crates/application/tests/command_job.rs": "b016ff004eac837fa88160c7764723ebbb6d6c02682bcf171d31d14bd518d6eb",
    "crates/domain/Cargo.toml": "481f801063336193d2c4748dd9018f9e925404ea9e087dc0824722a427c6aab8",
    "crates/domain/src/canonical.rs": "e9e82eb0d31bd2cef4a0e3ddeff415c197814c1a65f778fa87e8a7bf63722ffe",
    "crates/domain/src/commands/command.rs": "b8e540edee89241b7e468de60bc9d68974e179ddf403bee0650981a2db7ddc84",
    "crates/domain/src/commands/history.rs": "f667aeb82fbdddc6275168ef5e488fc3eda54513dfc7181ad2745ebc6ac2824d",
    "crates/domain/src/commands/mod.rs": "18a9efee8827744de9823e772de2dafea3175b20cc0427b23bd07233e5fbf041",
    "crates/domain/src/errors/error_registry.rs": "f9cca2f3aaa993ec8f7e5c867aca94c4e08a249e9d172b9df4bc0c93dce968f8",
    "crates/domain/src/errors/mod.rs": "e905095043aae8b030330431ebeaae450f4da608678d4afb3776d735f16f3928",
    "crates/domain/src/governance/decision.rs": "d11ba2ff6413b2f1c3ef680c0a3952671d4d669381f5045144f230c763b8cf67",
    "crates/domain/src/governance/gate.rs": "edb93fa53556f8183f64e9b6d06fffe1038380a4367737f20a6bd78ce36c9964",
    "crates/domain/src/governance/mod.rs": "daa655e9b22e630ef0a57b8e57217a8aea5145fc89bc512e307064e85cdaad40",
    "crates/domain/src/governance/priority.rs": "836f48a5a64d02ca846af50895a617df73aa7b9aab79150927a98b23a4f15df2",
    "crates/domain/src/governance/rule.rs": "2bc5691037d2537e0d4c7dd94172e3f1289347e353bda2fcb27a071527e5dcd8",
    "crates/domain/src/jobs/job.rs": "5920da4acd5c331a15abc1093a343c77da0febf2a51120b26b425dfa1a9b1a1f",
    "crates/domain/src/jobs/job_output.rs": "c1693821e79b9d1501fde8a3dc7282473e5c98a4683984d2404eee8ecdf3ac90",
    "crates/domain/src/jobs/mod.rs": "ceec998d0a9f5d9433b9435b7fc47fa7dc39bc150d6f0cf67a19f4b9ceb8b239",
    "crates/domain/src/lib.rs": "c085971be1622374b1581fb939d079be1557a5a4596b2c21be7a27f759b14700",
    "crates/domain/src/observability/audit_event.rs": "77b216d940828615694ad0e3cf950a8a5e140cc819a984344ff665f8edb3e3fa",
    "crates/domain/src/observability/mod.rs": "e5122ef6de91eb74315abe85f0892892bc36560bf08ca0916aaf3b9bdfbe8c79",
    "crates/domain/src/observability/observable_event.rs": "efe39f48ce7f26400c31354974b91405fcd40a6d5c899905b494974fa8e0bfb1",
    "crates/domain/src/storage/cas.rs": "8df4e4e1a5c072b19e9a0b5f3e8a0ec67dc6690c493a659c8c8fa3dbbfc186dc",
    "crates/domain/src/storage/clock.rs": "863f048d66424e1d491900e70d3076974ff0df06ebb0723edec576023f4aae92",
    "crates/domain/src/storage/governance_stream.rs": "b1871fa0854e34deab93a62dabe16a9adb6329065d85c3be3d820694c019a5c7",
    "crates/domain/src/storage/mod.rs": "894b47ef4fc94d8b4e1ad224b50a766d6296afd83957342ac97c540200116c25",
    "crates/domain/src/storage/project.rs": "d93bfd23ec2edf1bd59680432fe4eea629785a47ad543d3bc7538a9afa8bbcbc",
    "crates/domain/tests/governance_invariants.rs": "4ee53b5d6326d92546dded1e562b0bd21eafc78ca2365c9664556d7b5b63b98f",
    "apps/desktop/src-tauri/Cargo.toml": "46fd31daadc3d92e3d5a4498600e71e6a3740678eeb4aaef2a42388d704daeb8",
    "apps/desktop-ui/package.json": "08b9a1374e3bf21930e78dc0ad81e7c2e35563caaa2405bd0d392d6c391625fa",
    "tools/architecture/check-boundaries.mjs": "2e9da867efe71d953e988e4b16a3309980132edcfa238877148773cf7d9a5eaf",
    "tools/architecture/dependency-rules.json": "1e76ca7cc0d2711688910d5f01554fca883fb4ecae8f164aa1cc19720e73e575"
  },
  "logRefs": [],
  "reportRefs": [],
  "capabilityState": "VERIFIED",
  "externalBlockers": [],
  "previousEvidenceRef": null,
  "notRunReason": null,
  "payload": {
    "summary": "Workspace and dependency direction implemented.",
    "generatedBy": "tools/evidence/create-envelope.mjs"
  }
}
